Fund Name,Fund Ticker,1 Month,3 Month,6 Month,YTD,Since Inception Cumulative,1 Year,3 Year,5 Year,Since Inception Annualized,Date
FIS Knights of Columbus Global Belief ETF,KOCG NAV,-0.66,3.87,11.90,18.24,15.30,34.85,4.43,-,4.41,10/31/2024
FIS Knights of Columbus Global Belief ETF,KOCG MKT,-0.25,3.96,12.11,17.80,15.36,34.47,4.39,-,4.42,10/31/2024
FTSE All World Index - TR Net Tax,TAWNT01U,-2.34,2.53,10.79,15.81,20.90,32.47,5.52,-,5.92,10/31/2024
MSCI ACWI Net Total Return Index  (USD),NDUEACWF,-2.24,2.57,10.87,16.00,21.02,32.79,5.51,-,5.95,10/31/2024
FIS Christian Stock Fund,PRAY NAV,-1.81,1.63,10.85,14.56,19.60,31.92,-,-,6.78,10/31/2024
FIS Christian Stock Fund,PRAY MKT,-1.33,1.96,11.22,14.38,20.07,32.23,-,-,6.93,10/31/2024
MSCI THE WORLD INDEX Net (USD),NDDUWI,-1.98,2.45,11.13,16.50,24.61,33.68,-,-,8.40,10/31/2024
S&P 500 TR,SPTR2,-0.91,3.66,14.08,20.97,32.83,38.02,-,-,10.96,10/31/2024
